{
"salesforceDigitalProfileId":"hfghf",
"countryCode":"91",
"displayName":"mani",
"displayNameEditable":true,
"email":"mani@gmail.com",

"firstName":"mani",
"lastName":"Ganjam",

"postalCode":"5463278",
"phone":"65984573095",
"phoneType":"xyx",
"channelType":"dkjfflk",
"channelName":"abc",

"companyName":"invenio",
"jobTitle":"con",
"dobMonth":2,
"dobYear":1994

}
